"Task ID","Created At","Completed At","Last Modified",Name,Assignee,"Due Date",Tags,Notes,Projects,"Parent Task"
2897,2017-03-07,1970-01-01,1970-01-01,"iOS App UX Design, Feature &amp; Bug Review","sadequr_rahman,Maher Murshed,Justine Diener",2017-03-23,,,"Navigate Application Development",
2899,2017-03-01,1970-01-01,1970-01-01,"Recruit a Graphic Designer for UX designing","David Cheung,Peter Palarchio",2017-04-20,,,"Navigate Application Development","HR Tasks"
2901,2017-03-01,1970-01-01,1970-01-01,"Remove log in options through social accounts",,2017-03-01,,,"Navigate Application Development","UX Design, Features and Bug Review"
2902,2017-03-01,1970-01-01,1970-01-01,"Forgot password button action to be active",,2017-03-01,,,"Navigate Application Development","UX Design, Features and Bug Review"
2903,2017-03-01,1970-01-01,1970-01-01,"Change transition speed for My Feed &amp; Chat Panel slide-in","sadequr_rahman,Maher Murshed",2017-03-01,,,"Navigate Application Development","UX Design, Features and Bug Review"
2904,2017-03-01,1970-01-01,1970-01-01,"New chat messages should be populated on My Feed","sadequr_rahman,Maher Murshed",2017-03-01,,,"Navigate Application Development","UX Design, Features and Bug Review"
2905,2017-03-01,1970-01-01,1970-01-01,"Chat Group members can be added by pressing tab or enter on member's name","sadequr_rahman,Maher Murshed",2017-03-01,,,"Navigate Application Development","UX Design, Features and Bug Review"
2906,2017-03-01,1970-01-01,1970-01-01,"Pages to be designed for Project &amp; To-do where there is no data","sadequr_rahman,Maher Murshed",2017-03-01,,,"Navigate Application Development","UX Design, Features and Bug Review"
2907,2017-03-01,1970-01-01,1970-01-01,"By default sub-tasks should be expanded","sadequr_rahman,Maher Murshed",2017-03-01,,,"Navigate Application Development","UX Design, Features and Bug Review"
2908,2017-03-01,1970-01-01,1970-01-01,"Task &amp; Sub-task row gaps to be fixed","sadequr_rahman,Maher Murshed",2017-03-01,,,"Navigate Application Development","UX Design, Features and Bug Review"
2909,2017-03-01,1970-01-01,1970-01-01,"Task Title is not refreshing upon change","sadequr_rahman,Maher Murshed",2017-03-01,,,"Navigate Application Development","UX Design, Features and Bug Review"
2910,2017-03-01,1970-01-01,1970-01-01,"Create to-do from a chat text","sadequr_rahman,Maher Murshed",2017-03-01,,,"Navigate Application Development","UX Design, Features and Bug Review"
2911,2017-03-01,1970-01-01,1970-01-01,"When chat window pop-out, background screen is not looking nice. Need some options to fix that.","sadequr_rahman,Maher Murshed",2017-03-01,,,"Navigate Application Development","UX Design, Features and Bug Review"
2912,2017-03-01,1970-01-01,1970-01-01,"Number of tasks to be printed on dashboard &amp; the circle should show the progress %","sadequr_rahman,Maher Murshed",2017-03-01,,,"Navigate Application Development","UX Design, Features and Bug Review"
2913,2017-03-01,1970-01-01,1970-01-01,"Some sort of marking to show that we are on dashboard","sadequr_rahman,Maher Murshed",2017-03-01,,,"Navigate Application Development","UX Design, Features and Bug Review"
2914,2017-03-01,1970-01-01,1970-01-01,"Add a calendar when there is no schedule. Calendar section on homepage and it should have option to toggle between calendar and schedule","sadequr_rahman,Maher Murshed",2017-03-01,,,"Navigate Application Development","UX Design, Features and Bug Review"
2915,2017-03-01,1970-01-01,1970-01-01,"Weather section should be on right side and much smaller to make that panel smaller","sadequr_rahman,Maher Murshed",2017-03-01,,,"Navigate Application Development","UX Design, Features and Bug Review"
2916,2017-03-01,1970-01-01,1970-01-01,"News feed option in My feed section for subscription","sadequr_rahman,Maher Murshed",2017-03-01,,,"Navigate Application Development","UX Design, Features and Bug Review"
2917,2017-03-01,1970-01-01,1970-01-01,"Profile Pic &amp; sub-menu fixation - picture is too big with less options now","sadequr_rahman,Maher Murshed",2017-03-01,,,"Navigate Application Development","UX Design, Features and Bug Review"
2918,2017-03-01,1970-01-01,1970-01-01,"After creating a new project, stay on that project and cursor should be on new task bar","sadequr_rahman,Maher Murshed",2017-03-01,,,"Navigate Application Development","UX Design, Features and Bug Review"
2919,2017-03-01,1970-01-01,1970-01-01,"Sub-task add bar will go away once press ESC or click anywgere on page","sadequr_rahman,Maher Murshed",2017-03-01,,,"Navigate Application Development","UX Design, Features and Bug Review"
2920,2017-03-01,1970-01-01,1970-01-01,"Click on Task or Sub-task tile will open the Properties page","sadequr_rahman,Maher Murshed",2017-03-01,,,"Navigate Application Development","UX Design, Features and Bug Review"
2921,2017-03-01,1970-01-01,1970-01-01,"In Project &amp; Task properties, add admin &amp; members line should bring list when clicked instead of pressing add button. Add button should be there for novice user.","sadequr_rahman,Maher Murshed",2017-03-01,,,"Navigate Application Development","UX Design, Features and Bug Review"
2923,2017-03-13,1970-01-01,1970-01-01,"Project Header tile needs to be re-designed keeping memebrs icon there with a task number &amp; progress bar","sadequr_rahman,Maher Murshed",2017-03-13,,,"Navigate Application Development","UX Design, Features and Bug Review"
2924,2017-03-01,1970-01-01,1970-01-01,"Remove date bar from project task segment","sadequr_rahman,Maher Murshed",2017-03-01,,,"Navigate Application Development","UX Design, Features and Bug Review"
2925,2017-03-01,1970-01-01,1970-01-01,"Put a plus sign right after task title to create sub-task and remove sub-task icon from panel","sadequr_rahman,Maher Murshed",2017-03-01,,,"Navigate Application Development","UX Design, Features and Bug Review"
2926,2017-03-01,1970-01-01,1970-01-01,"Use co-owner instead of project admin","sadequr_rahman,Maher Murshed",2017-03-01,,,"Navigate Application Development","UX Design, Features and Bug Review"
2927,2017-03-01,1970-01-01,1970-01-01,"End date should be red if that exceeds the current date","sadequr_rahman,Maher Murshed",2017-03-01,,,"Navigate Application Development","UX Design, Features and Bug Review"
2928,2017-03-01,1970-01-01,1970-01-01,"Drag-n-drop sub-task from one task header to another","sadequr_rahman,Maher Murshed",2017-03-01,,,"Navigate Application Development","UX Design, Features and Bug Review"
2929,2017-03-01,1970-01-01,1970-01-01,"Remove status: Prospecting, Delivered, Completed, Archived","sadequr_rahman,Maher Murshed",2017-03-01,,,"Navigate Application Development","UX Design, Features and Bug Review"
2930,2017-03-01,1970-01-01,1970-01-01,"Allow people to Add option to create more status labels and that should be available for others in the same project","sadequr_rahman,Maher Murshed",2017-03-01,,,"Navigate Application Development","UX Design, Features and Bug Review"
2931,2017-03-01,1970-01-01,1970-01-01,"Remove project group &amp; add Track your hours","sadequr_rahman,Maher Murshed",2017-03-01,,,"Navigate Application Development","UX Design, Features and Bug Review"
2932,2017-03-01,1970-01-01,1970-01-01,"Create a flow-chart for time tracking - review current Microsoft project &amp; timesheet business logics. Master time sheet module to be designed to capture actual hours","sadequr_rahman,Maher Murshed",2017-03-01,,,"Navigate Application Development","UX Design, Features and Bug Review"
2933,2017-03-01,1970-01-01,1970-01-01,"Remove color label from to-do","sadequr_rahman,Maher Murshed",2017-03-01,,,"Navigate Application Development","UX Design, Features and Bug Review"
2934,2017-03-05,1970-01-01,1970-01-01,"Sentence punctuation checking in Chatting.","Maher Murshed,sadequr_rahman,David Cheung,Peter Palarchio",2017-03-06,,,"Navigate Application Development","UX Design, Features and Bug Review"
2935,2017-03-06,1970-01-01,1970-01-01,"Hot key(ctrl+?) to search todo or task","Maher Murshed,sadequr_rahman,David Cheung,Peter Palarchio",2017-03-06,,"If you click ctrl+ s in todo create box, then it will switch to search box.After searching if you again press ctrl+s ,then it will again turn to create todo box.","Navigate Application Development","UX Design, Features and Bug Review"
2936,2017-03-13,1970-01-01,1970-01-01,"Add a vertical blue bar on current task &amp; sub-task I am currently on","Maher Murshed,Anwar Ali,sadequr_rahman",2017-03-13,,,"Navigate Application Development","UX Design, Features and Bug Review"
2937,2017-03-13,1970-01-01,1970-01-01,"Remember position when I am coming back from Project Properties page","Anwar Ali,Maher Murshed,sadequr_rahman",2017-03-13,,,"Navigate Application Development","UX Design, Features and Bug Review"
2938,2017-03-13,1970-01-01,1970-01-01,"Each status should be colored text for better legend. Initiated can be gray, completed green, hold red, in progress blue, waiting for feedback orange","Anwar Ali,Maher Murshed,sadequr_rahman",2017-03-13,,,"Navigate Application Development","UX Design, Features and Bug Review"
2939,2017-03-13,1970-01-01,1970-01-01,"Instead of properties button, sub-task should have option button to keep properties and add another sub-task menu","Anwar Ali,Maher Murshed,sadequr_rahman",2017-03-25,,,"Navigate Application Development","UX Design, Features and Bug Review"
2943,2017-03-25,1970-01-01,1970-01-01,"Project alert in project bar, alert/filter option, each project has marking for alert","Anwar Ali,Maher Murshed,sadequr_rahman",,,,"Navigate Application Development","UX Design, Features and Bug Review"
2945,2017-04-27,1970-01-01,1970-01-01,"Scroll in Left menu bar","Anwar Ali,Maher Murshed,sadequr_rahman",2017-04-27,,,"Navigate Application Development","UX Design, Features and Bug Review"
2946,2017-05-03,2017-05-03,2017-05-03,"Drill down status report for project","sadequr_rahman,Maher Murshed,Anwar Ali",2017-05-03,,,"Navigate Application Development","UX Design, Features and Bug Review"
2922,2017-03-01,1970-01-01,1970-01-01,"Branding &amp; Marketing Tasks","sadequr_rahman,Maher Murshed",2017-03-23,,,"Navigate Application Development",
2941,2017-03-23,1970-01-01,1970-01-01,"Android app UX design with documentaion","Anwar Ali,sadequr_rahman,Maher Murshed",2017-03-23,,,"Navigate Application Development","Android App UX Design, Feature &amp; Bug Review"
2942,2017-03-23,1970-01-01,2017-04-25,"Android api development for db communication","Anwar Ali,sadequr_rahman,Maher Murshed",,,,"Navigate Application Development","Android App UX Design, Feature &amp; Bug Review"
2944,2017-04-18,1970-01-01,1970-01-01,ddd,"Demo,sadequr_rahman,Maher Murshed",,,,"Navigate Application Development",
